{
  "schemaVersion": 1,
  "sourceSha": "b7399458394ee3f9e08c9d26f6eae67320b1ae99",
  "generatedAt": "2026-10-15T08:31:00.567Z",
  "status": "complete",
  "measurement": "requestAnimationFrame consecutive intervals; not GPU time or guaranteed gameplay FPS",
  "fixture": "release visual matrix: frozen Game.update, paused physics/tweens, fixed sprite pose",
  "policy": {
    "warmupFrames": 10,
    "minSamples": 60,
    "minWindowMs": 1000,
    "timeoutMs": 30000
  },
  "browserVersion": "155.0.8059.40",
  "results": [
    {
      "renderer": "webgl",
      "tier": "full",
      "enemyCount": 100,
      "viewport": {
        "width": 390,
        "height": 740
      },
      "deviceScaleFactor": 2,
      "sampleCount": 60,
      "windowMs": 6632.299999999999,
      "p50Ms": 116.59999999999991,
      "p95Ms": 116.70000000000073,
      "over33_3MsRatio": 1,
      "intervalsMs": [
        116.69999999999982,
        100,
        116.60000000000036,
        99.89999999999964,
        116.60000000000036,
        100.09999999999945,
        116.70000000000073,
        99.89999999999964,
        116.60000000000036,
        116.69999999999982,
        100,
        116.59999999999945,
        116.70000000000073,
        100.09999999999945,
        116.60000000000036,
        100,
        116.59999999999945,
        116.70000000000073,
        99.89999999999964,
        116.79999999999927,
        116.60000000000036,
        99.89999999999964,
        116.70000000000073,
        116.60000000000036,
        100.10000000000036,
        116.59999999999854,
        116.60000000000036,
        100,
        116.70000000000073,
        116.60000000000036,
        100,
        116.69999999999891,
        116.60000000000036,
        116.70000000000073,
        100,
        116.59999999999854,
        116.70000000000073,
        100,
        116.5,
        116.79999999999927,
        99.90000000000146,
        116.59999999999854,
        116.70000000000073,
        99.89999999999964,
        116.70000000000073,
        116.69999999999891,
        99.90000000000146,
        116.69999999999891,
        116.60000000000036,
        100,
        116.70000000000073,
        100,
        116.59999999999854,
        100,
        116.60000000000036,
        116.60000000000036,
        100,
        116.70000000000073,
        100,
        116.59999999999854
      ]
    },
    {
      "renderer": "webgl",
      "tier": "full",
      "enemyCount": 150,
      "viewport": {
        "width": 390,
        "height": 740
      },
      "deviceScaleFactor": 2,
      "sampleCount": 60,
      "windowMs": 7932,
      "p50Ms": 133.29999999999927,
      "p95Ms": 133.40000000000146,
      "over33_3MsRatio": 1,
      "intervalsMs": [
        116.69999999999709,
        133.20000000000073,
        133.29999999999927,
        133.40000000000146,
        133.29999999999927,
        133.29999999999927,
        133.3000000000029,
        133.29999999999927,
        133.29999999999927,
        133.20000000000073,
        133.39999999999782,
        133.5,
        133.3000000000029,
        133.1999999999971,
        133.40000000000146,
        133.29999999999927,
        133.29999999999927,
        133.3000000000029,
        133.39999999999782,
        133.20000000000073,
        133.40000000000146,
        133.29999999999927,
        133.29999999999927,
        133.29999999999927,
        133.29999999999927,
        133.3000000000029,
        133.39999999999782,
        133.29999999999927,
        133.20000000000073,
        116.70000000000073,
        133.29999999999927,
        133.29999999999927,
        133.40000000000146,
        133.20000000000073,
        133.39999999999782,
        133.3000000000029,
        133.1999999999971,
        133.40000000000146,
        133.29999999999927,
        133.29999999999927,
        133.3000000000029,
        133.29999999999927,
        133.29999999999927,
        116.70000000000073,
        133.29999999999927,
        133.29999999999927,
        133.29999999999927,
        133.3000000000029,
        133.39999999999782,
        133.29999999999927,
        133.20000000000073,
        133.40000000000146,
        133.29999999999927,
        133.29999999999927,
        133.29999999999927,
        133.3000000000029,
        116.69999999999709,
        133.20000000000073,
        133.40000000000146,
        133.20000000000073
      ]
    },
    {
      "renderer": "webgl",
      "tier": "full",
      "enemyCount": 200,
      "viewport": {
        "width": 390,
        "height": 740
      },
      "deviceScaleFactor": 2,
      "sampleCount": 60,
      "windowMs": 8981.600000000002,
      "p50Ms": 150,
      "p95Ms": 166.59999999999891,
      "over33_3MsRatio": 1,
      "intervalsMs": [
        149.79999999999927,
        150.10000000000218,
        150,
        150,
        149.89999999999782,
        166.70000000000073,
        149.90000000000146,
        150,
        166.59999999999854,
        150,
        150,
        149.90000000000146,
        150,
        150,
        149.89999999999782,
        166.70000000000073,
        149.90000000000146,
        149.99999999999636,
        150,
        150,
        166.60000000000582,
        150,
        150,
        150,
        150,
        149.79999999999563,
        150.09999999999854,
        150,
        149.90000000000146,
        150,
        149.90000000000146,
        150.09999999999854,
        166.5,
        150.09999999999854,
        149.90000000000146,
        150,
        150,
        150,
        149.90000000000146,
        150,
        150,
        149.90000000000146,
        133.29999999999563,
        150,
        133.3000000000029,
        150,
        133.3000000000029,
        150,
        149.89999999999418,
        133.3000000000029,
        150,
        133.3000000000029,
        150,
        149.89999999999418,
        133.40000000000146,
        149.90000000000146,
        149.90000000000146,
        150,
        150,
        150
      ]
    },
    {
      "renderer": "canvas",
      "tier": "reduced",
      "enemyCount": 100,
      "viewport": {
        "width": 390,
        "height": 740
      },
      "deviceScaleFactor": 2,
      "sampleCount": 60,
      "windowMs": 4316,
      "p50Ms": 66.69999999999982,
      "p95Ms": 83.40000000000055,
      "over33_3MsRatio": 0.9833333333333333,
      "intervalsMs": [
        66.69999999999982,
        66.70000000000027,
        66.59999999999991,
        66.69999999999982,
        66.69999999999982,
        83.30000000000018,
        66.69999999999982,
        66.60000000000036,
        66.60000000000036,
        66.69999999999982,
        66.59999999999945,
        66.70000000000073,
        83.29999999999927,
        66.70000000000073,
        66.59999999999945,
        83.40000000000055,
        66.59999999999945,
        83.30000000000018,
        66.69999999999982,
        83.40000000000055,
        66.59999999999945,
        83.30000000000018,
        66.60000000000036,
        66.69999999999982,
        83.30000000000018,
        66.69999999999982,
        83.30000000000018,
        66.69999999999982,
        66.59999999999945,
        83.30000000000018,
        66.69999999999982,
        83.30000000000018,
        66.60000000000036,
        83.39999999999964,
        66.60000000000036,
        66.59999999999945,
        83.30000000000018,
        66.69999999999982,
        83.40000000000055,
        66.69999999999982,
        83.30000000000018,
        66.59999999999945,
        66.70000000000073,
        83.29999999999927,
        66.70000000000073,
        149.89999999999964,
        16.699999999999818,
        49.900000000000546,
        83.39999999999964,
        66.60000000000036,
        66.69999999999982,
        83.39999999999964,
        66.60000000000036,
        66.69999999999982,
        66.60000000000036,
        66.59999999999945,
        66.69999999999982,
        66.60000000000036,
        66.69999999999982,
        83.30000000000018
      ]
    },
    {
      "renderer": "canvas",
      "tier": "reduced",
      "enemyCount": 150,
      "viewport": {
        "width": 390,
        "height": 740
      },
      "deviceScaleFactor": 2,
      "sampleCount": 60,
      "windowMs": 5849,
      "p50Ms": 100,
      "p95Ms": 100.09999999999863,
      "over33_3MsRatio": 1,
      "intervalsMs": [
        100,
        99.90000000000146,
        100,
        100,
        83.29999999999927,
        99.89999999999964,
        100,
        100,
        100,
        100,
        100.10000000000036,
        99.89999999999964,
        100,
        100,
        99.89999999999964,
        83.40000000000146,
        100,
        100,
        99.89999999999964,
        100,
        100,
        100,
        100,
        100,
        99.89999999999964,
        83.39999999999964,
        99.89999999999964,
        100.10000000000036,
        100,
        99.89999999999964,
        100,
        100,
        83.30000000000109,
        100,
        100,
        99.89999999999964,
        100.10000000000036,
        100,
        99.89999999999964,
        83.29999999999927,
        100,
        100,
        99.90000000000146,
        100.09999999999854,
        83.30000000000109,
        100,
        100,
        99.89999999999964,
        83.29999999999927,
        100,
        100,
        83.29999999999927,
        100,
        100,
        100,
        99.90000000000146,
        83.40000000000146,
        100,
        100,
        99.89999999999782
      ]
    },
    {
      "renderer": "canvas",
      "tier": "reduced",
      "enemyCount": 200,
      "viewport": {
        "width": 390,
        "height": 740
      },
      "deviceScaleFactor": 2,
      "sampleCount": 60,
      "windowMs": 6982,
      "p50Ms": 116.60000000000218,
      "p95Ms": 133.29999999999927,
      "over33_3MsRatio": 1,
      "intervalsMs": [
        116.59999999999854,
        116.60000000000218,
        116.69999999999709,